[
  {
    "event_id": "00000000-0000-4000-8000-000000001001",
    "ts": "2026-10-29T14:00:07.000Z",
    "session": "8f14e45f-ceea-467a-9a3c-5e0a9d4b2c11",
    "seed": 42,
    "world_v": 3,
    "level": 0,
    "type": "sesion_inicio",
    "x": 429638660491.5,
    "y": 282355261234.5,
    "z": 1119679029,
    "client": {
      "platform": "desktop",
      "version": "0.4.0",
      "debug": false
    },
    "data": {
      "zona": "1678276017,1102950239,1119679029"
    }
  },
  {
    "event_id": "00000000-0000-4000-8000-000000001002",
    "ts": "2026-10-29T14:00:14.000Z",
    "session": "8f14e45f-ceea-467a-9a3c-5e0a9d4b2c11",
    "seed": 42,
    "world_v": 3,
    "level": 0,
    "type": "posicion",
    "x": 429638660491.5,
    "y": 282355261234.5,
    "z": 1119679029,
    "client": {
      "platform": "desktop",
      "version": "0.4.0",
      "debug": false
    },
    "data": {
      "velocidad": 1.7,
      "humor": "calm"
    }
  },
  {
    "event_id": "00000000-0000-4000-8000-000000001003",
    "ts": "2026-10-29T14:00:21.000Z",
    "session": "8f14e45f-ceea-467a-9a3c-5e0a9d4b2c11",
    "seed": 42,
    "world_v": 3,
    "level": 0,
    "type": "zona_cambio",
    "x": 429638660491.5,
    "y": 282355261234.5,
    "z": 1119679029,
    "client": {
      "platform": "desktop",
      "version": "0.4.0",
      "debug": false
    },
    "data": {
      "zona": "1678276018,1102950239,1119679029",
      "via": "caminando"
    }
  },
  {
    "event_id": "00000000-0000-4000-8000-000000001004",
    "ts": "2026-10-29T14:00:28.000Z",
    "session": "8f14e45f-ceea-467a-9a3c-5e0a9d4b2c11",
    "seed": 42,
    "world_v": 3,
    "level": 0,
    "type": "zona_cambio",
    "x": 429638660491.5,
    "y": 282355261234.5,
    "z": 1119679030,
    "client": {
      "platform": "desktop",
      "version": "0.4.0",
      "debug": false
    },
    "data": {
      "zona": "1678276018,1102950239,1119679030",
      "via": "puerta"
    }
  },
  {
    "event_id": "00000000-0000-4000-8000-000000001005",
    "ts": "2026-10-29T14:00:35.000Z",
    "session": "8f14e45f-ceea-467a-9a3c-5e0a9d4b2c11",
    "seed": 42,
    "world_v": 3,
    "level": 0,
    "type": "laberinto_cambio",
    "x": 429638660491.5,
    "y": 282355261234.5,
    "z": 1119679029,
    "client": {
      "platform": "desktop",
      "version": "0.4.0",
      "debug": false
    },
    "data": {
      "bloque_x": 429638660480,
      "bloque_y": 282355261232,
      "bloque_lado": 16,
      "capa_antes": 1119679029,
      "capa_despues": 1119679031
    }
  },
  {
    "event_id": "00000000-0000-4000-8000-000000001006",
    "ts": "2026-10-29T14:00:42.000Z",
    "session": "8f14e45f-ceea-467a-9a3c-5e0a9d4b2c11",
    "seed": 42,
    "world_v": 3,
    "level": 0,
    "type": "deteccion",
    "x": 429638660491.5,
    "y": 282355261234.5,
    "z": 1119679029,
    "client": {
      "platform": "desktop",
      "version": "0.4.0",
      "debug": false
    },
    "data": {
      "distancia_m": 17.4
    }
  },
  {
    "event_id": "00000000-0000-4000-8000-000000001007",
    "ts": "2026-10-29T14:00:49.000Z",
    "session": "8f14e45f-ceea-467a-9a3c-5e0a9d4b2c11",
    "seed": 42,
    "world_v": 3,
    "level": 0,
    "type": "aparicion",
    "x": 429638660491.5,
    "y": 282355261234.5,
    "z": 1119679029,
    "client": {
      "platform": "desktop",
      "version": "0.4.0",
      "debug": false
    },
    "data": {
      "distancia_m": null
    }
  },
  {
    "event_id": "00000000-0000-4000-8000-000000001008",
    "ts": "2026-10-29T14:00:56.000Z",
    "session": "8f14e45f-ceea-467a-9a3c-5e0a9d4b2c11",
    "seed": 42,
    "world_v": 3,
    "level": 0,
    "type": "persecucion_inicio",
    "x": 429638660491.5,
    "y": 282355261234.5,
    "z": 1119679029,
    "client": {
      "platform": "desktop",
      "version": "0.4.0",
      "debug": false
    },
    "data": {
      "persecucion_id": "3c59dc04-8f5e-4c3b-a1d2-77b5f0e3a9c4",
      "distancia_m": 12.2
    }
  },
  {
    "event_id": "00000000-0000-4000-8000-000000001009",
    "ts": "2026-10-29T14:01:03.000Z",
    "session": "8f14e45f-ceea-467a-9a3c-5e0a9d4b2c11",
    "seed": 42,
    "world_v": 3,
    "level": 0,
    "type": "escape",
    "x": 429638660491.5,
    "y": 282355261234.5,
    "z": 1119679029,
    "client": {
      "platform": "desktop",
      "version": "0.4.0",
      "debug": false
    },
    "data": {
      "persecucion_id": "3c59dc04-8f5e-4c3b-a1d2-77b5f0e3a9c4",
      "duracion_s": 30.1,
      "via": "retirada"
    }
  },
  {
    "event_id": "00000000-0000-4000-8000-00000000100a",
    "ts": "2026-10-29T14:01:10.000Z",
    "session": "8f14e45f-ceea-467a-9a3c-5e0a9d4b2c11",
    "seed": 42,
    "world_v": 3,
    "level": 0,
    "type": "captura",
    "x": 429638660491.5,
    "y": 282355261234.5,
    "z": 1119679029,
    "client": {
      "platform": "desktop",
      "version": "0.4.0",
      "debug": false
    },
    "data": {
      "persecucion_id": null,
      "duracion_s": 0,
      "humor": "stalk"
    }
  },
  {
    "event_id": "00000000-0000-4000-8000-00000000100b",
    "ts": "2026-10-29T14:01:17.000Z",
    "session": "8f14e45f-ceea-467a-9a3c-5e0a9d4b2c11",
    "seed": 42,
    "world_v": 3,
    "level": 0,
    "type": "noclip",
    "x": 429638660491.5,
    "y": 282355261234.5,
    "z": 1119679029,
    "client": {
      "platform": "desktop",
      "version": "0.4.0",
      "debug": false
    },
    "data": {
      "nivel_origen": 0,
      "nivel_destino": 1
    }
  },
  {
    "event_id": "00000000-0000-4000-8000-00000000100c",
    "ts": "2026-10-29T14:01:24.000Z",
    "session": "8f14e45f-ceea-467a-9a3c-5e0a9d4b2c11",
    "seed": 42,
    "world_v": 3,
    "level": 0,
    "type": "escape",
    "x": 429638660491.5,
    "y": 282355261234.5,
    "z": 1119679029,
    "client": {
      "platform": "desktop",
      "version": "0.4.0",
      "debug": false
    },
    "data": {
      "persecucion_id": "3c59dc04-8f5e-4c3b-a1d2-77b5f0e3a9c4",
      "duracion_s": 8.4,
      "via": "noclip"
    }
  },
  {
    "event_id": "00000000-0000-4000-8000-00000000100d",
    "ts": "2026-10-29T14:01:31.000Z",
    "session": "8f14e45f-ceea-467a-9a3c-5e0a9d4b2c11",
    "seed": 42,
    "world_v": 3,
    "level": 1,
    "type": "zona_cambio",
    "x": 429638660491.5,
    "y": 282355261234.5,
    "z": 1119679029,
    "client": {
      "platform": "desktop",
      "version": "0.4.0",
      "debug": false
    },
    "data": {
      "zona": "1678276017,1102950239,1119679029",
      "via": "noclip"
    }
  },
  {
    "event_id": "00000000-0000-4000-8000-00000000100e",
    "ts": "2026-10-29T14:01:38.000Z",
    "session": "8f14e45f-ceea-467a-9a3c-5e0a9d4b2c11",
    "seed": 42,
    "world_v": 3,
    "level": 1,
    "type": "posicion",
    "x": 429638660491.5,
    "y": 282355261234.5,
    "z": 1119679029,
    "client": {
      "platform": "desktop",
      "version": "0.4.0",
      "debug": true
    },
    "data": {
      "velocidad": 0,
      "humor": "hunt"
    }
  },
  {
    "event_id": "00000000-0000-4000-8000-00000000100f",
    "ts": "2026-10-29T14:01:45.000Z",
    "session": "8f14e45f-ceea-467a-9a3c-5e0a9d4b2c11",
    "seed": 42,
    "world_v": 3,
    "level": 1,
    "type": "sesion_fin",
    "x": 429638660491.5,
    "y": 282355261234.5,
    "z": 1119679029,
    "client": {
      "platform": "desktop",
      "version": "0.4.0",
      "debug": false
    },
    "data": {
      "motivo": "salida"
    }
  }
]
